"Dolor autem tempora vitae ut.","Zula Goldner MD","Ad facere laborum voluptatem. Et rerum dolorem sit molestiae. Ratione voluptatum vel quisquam cupiditate.",28.70
"Dolores a odit temporibus laborum perferendis.","Neal Hermann","Commodi et ex est enim aliquam. Autem vero recusandae cupiditate dolores occaecati molestias.",18.29
"Doloribus est deserunt aut error doloribus quam nihil.","Jordan Sipes","Voluptatem est et repudiandae architecto. Delectus corporis deleniti sapiente temporibus aperiam. Doloremque ut quia quidem adipisci et aut reiciendis. Temporibus esse facere tempora ea praesentium aliquid.",49.72
"Ea qui recusandae dolorem mollitia eum dolor excepturi cumque.","Kaleb Wilkinson","Nihil nemo magni repudiandae non aut. Voluptatem aut ducimus rerum et sapiente et quis animi. Et adipisci incidunt perspiciatis in velit qui.",97.37
"Exercitationem numquam qui autem placeat laborum autem quidem.","Lazaro Ruecker","Sint autem eveniet ut enim. Vitae omnis neque quis consequatur. Quaerat eum omnis sint officia maxime magni. Officia aut voluptate impedit excepturi in sit animi.",56.01
"Maxime dolore est repudiandae.","Miss Amely Herman","Ipsum enim reprehenderit atque. Ut nemo vero aut. Dicta voluptas repellat unde voluptatem minus enim velit fuga.",60.26
"Pariatur fuga et harum.","Clare Spinka","Temporibus sit aperiam qui ipsam. Voluptates cum eum voluptates eveniet aliquam id. Aut blanditiis eligendi quia eaque repellendus aut quas. Sit debitis sed aut sit at reprehenderit rem. Perspiciatis est laboriosam velit quisquam qui.",84.60
"Quibusdam modi voluptatibus nobis qui.","Dr. Ken Koch","Molestiae excepturi consequatur molestiae et id aut. Eum esse quod voluptatem quas. Et dolorem amet quia ullam ducimus. Veniam labore doloribus voluptatem explicabo et.",42.62
"Sit quo omnis consequatur non nihil iste harum natus.","Nicolas Blick","Iusto debitis expedita quis. At suscipit neque cupiditate dignissimos possimus. Libero ea dolorum deleniti atque qui cumque et. Quia molestias magnam id sunt. Sapiente labore culpa molestiae aspernatur recusandae placeat.",80.75
"Sunt voluptate et quis ab et est eveniet.","Dr. Katherine Moen Sr.","Et aliquam asperiores ratione illo doloremque. Nostrum vero recusandae debitis est eum inventore. Rerum perspiciatis velit possimus amet eveniet. Non quia numquam et repellendus magni commodi est iste.",91.83
